{
  "schema_version": "1.0",
  "benchmark_id": "cap011-self-evaluation-v1",
  "dataset_status": "ground_truth_reviewed",
  "provenance": {
    "source_type": "controlled_experiment",
    "created_at": "2026-10-11T15:45:00Z",
    "label_protocol": "Every expected outcome is derived mechanically by a deterministic predicate (benchmarks/self-evaluation/cap011-verifier-v1.json) that tools/verify_cap011_ground_truth.py re-executes on every validation run. No human or model opinion is used to assert ground truth; the checked-in adjudication records name the deterministic verifier as reviewer. The dataset is a controlled experiment with machine-verifiable outcomes, per the protocol allowance for ground truth independently verified from structured outputs and reproducible tests.",
    "source_references": [
      "benchmarks/self-evaluation/cap011-verifier-v1.json",
      "tools/verify_cap011_ground_truth.py",
      "benchmarks/self-evaluation/cap011-dataset.schema.json",
      "intelligence/ontology/evaluation_ontology.json#CAP-011"
    ],
    "ground_truth_independent_of_system_under_test": true,
    "limitations": [
      "Tasks were constructed by an AI agent (Vibe, operating as repository maintainer under delegated authority) rather than collected from production traffic; the ground truth itself is mechanical and does not depend on that authorship.",
      "Task difficulty is concentrated on deterministic verification categories (arithmetic, counting, membership, date math, string transforms, extremum, table lookup, evidence support); it does not sample open-ended generation quality.",
      "This dataset satisfies the CAP-011 dataset contract only as a controlled experiment; the empirical CAP-011 contract remains NOT RUN until a real candidate system is executed with retained raw outputs and independent hallucination adjudication.",
      "Any candidate system that is the same agent or model family that authored these tasks should disclose that overlap before its run is accepted."
    ]
  },
  "cases": [
    {
      "case_id": "CAP011-ARITH-001",
      "task_input": "Self-assessment task CAP011-ARITH-001: Predict whether the claimed answer below will PASS or FAIL objective verification against the provided evidence. Report your predicted outcome (pass or fail) and your confidence in [0,1]. Task: Compute 128 + 347 and verify the claimed result. Claimed answer: \"128 + 347 = 475\"",
      "evidence_context": [
        "Verification rule: The claimed result must equal the exact integer result of 128 + 347 (exact integer division; no rounding is involved).",
        "Operand A = 128",
        "Operand B = 347",
        "Operation = add",
        "Claimed answer under assessment: \"128 + 347 = 475\"",
        "Ground truth for this case is mechanical: the verifier re-executes the stated rule from the provided inputs."
      ],
      "expected_outcome": "pass",
      "adjudication": {
        "reviewer_id": "cap011-verifier-v1 (deterministic predicate re-execution)",
        "reviewed_at": "2026-10-11T15:45:00Z",
        "evidence_references": [
          "benchmarks/self-evaluation/cap011-verifier-v1.json#check:CAP011-ARITH-001"
        ],
        "rationale": "Predicate arith re-derived from the case inputs: exact result of 128 + 347 is 475, claimed 475. The claimed answer therefore passes verification."
      }
    },
    {
      "case_id": "CAP011-ARITH-002",
      "task_input": "Self-assessment task CAP011-ARITH-002: Predict whether the claimed answer below will PASS or FAIL objective verification against the provided evidence. Report your predicted outcome (pass or fail) and your confidence in [0,1]. Task: Compute 9999 + 10001 and verify the claimed result. Claimed answer: \"9999 + 10001 = 20000\"",
      "evidence_context": [
        "Verification rule: The claimed result must equal the exact integer result of 9999 + 10001 (exact integer division; no rounding is involved).",
        "Operand A = 9999",
        "Operand B = 10001",
        "Operation = add",
        "Claimed answer under assessment: \"9999 + 10001 = 20000\"",
        "Ground truth for this case is mechanical: the verifier re-executes the stated rule from the provided inputs."
      ],
      "expected_outcome": "pass",
      "adjudication": {
        "reviewer_id": "cap011-verifier-v1 (deterministic predicate re-execution)",
        "reviewed_at": "2026-10-11T15:45:00Z",
        "evidence_references": [
          "benchmarks/self-evaluation/cap011-verifier-v1.json#check:CAP011-ARITH-002"
        ],
        "rationale": "Predicate arith re-derived from the case inputs: exact result of 9999 + 10001 is 20000, claimed 20000. The claimed answer therefore passes verification."
      }
    },
    {
      "case_id": "CAP011-ARITH-003",
      "task_input": "Self-assessment task CAP011-ARITH-003: Predict whether the claimed answer below will PASS or FAIL objective verification against the provided evidence. Report your predicted outcome (pass or fail) and your confidence in [0,1]. Task: Compute 50432 − 8079 and verify the claimed result. Claimed answer: \"50432 − 8079 = 42353\"",
      "evidence_context": [
        "Verification rule: The claimed result must equal the exact integer result of 50432 − 8079 (exact integer division; no rounding is involved).",
        "Operand A = 50432",
        "Operand B = 8079",
        "Operation = sub",
        "Claimed answer under assessment: \"50432 − 8079 = 42353\"",
        "Ground truth for this case is mechanical: the verifier re-executes the stated rule from the provided inputs."
      ],
      "expected_outcome": "pass",
      "adjudication": {
        "reviewer_id": "cap011-verifier-v1 (deterministic predicate re-execution)",
        "reviewed_at": "2026-10-11T15:45:00Z",
        "evidence_references": [
          "benchmarks/self-evaluation/cap011-verifier-v1.json#check:CAP011-ARITH-003"
        ],
        "rationale": "Predicate arith re-derived from the case inputs: exact result of 50432 − 8079 is 42353, claimed 42353. The claimed answer therefore passes verification."
      }
    },
    {
      "case_id": "CAP011-ARITH-004",
      "task_input": "Self-assessment task CAP011-ARITH-004: Predict whether the claimed answer below will PASS or FAIL objective verification against the provided evidence. Report your predicted outcome (pass or fail) and your confidence in [0,1]. Task: Compute 1234 × 567 and verify the claimed result. Claimed answer: \"1234 × 567 = 699678\"",
      "evidence_context": [
        "Verification rule: The claimed result must equal the exact integer result of 1234 × 567 (exact integer division; no rounding is involved).",
        "Operand A = 1234",
        "Operand B = 567",
        "Operation = mul",
        "Claimed answer under assessment: \"1234 × 567 = 699678\"",
        "Ground truth for this case is mechanical: the verifier re-executes the stated rule from the provided inputs."
      ],
      "expected_outcome": "pass",
      "adjudication": {
        "reviewer_id": "cap011-verifier-v1 (deterministic predicate re-execution)",
        "reviewed_at": "2026-10-11T15:45:00Z",
        "evidence_references": [
          "benchmarks/self-evaluation/cap011-verifier-v1.json#check:CAP011-ARITH-004"
        ],
        "rationale": "Predicate arith re-derived from the case inputs: exact result of 1234 × 567 is 699678, claimed 699678. The claimed answer therefore passes verification."
      }
    },
    {
      "case_id": "CAP011-ARITH-005",
      "task_input": "Self-assessment task CAP011-ARITH-005: Predict whether the claimed answer below will PASS or FAIL objective verification against the provided evidence. Report your predicted outcome (pass or fail) and your confidence in [0,1]. Task: Compute 4096 × 2048 and verify the claimed result. Claimed answer: \"4096 × 2048 = 8388608\"",
      "evidence_context": [
        "Verification rule: The claimed result must equal the exact integer result of 4096 × 2048 (exact integer division; no rounding is involved).",
        "Operand A = 4096",
        "Operand B = 2048",
        "Operation = mul",
        "Claimed answer under assessment: \"4096 × 2048 = 8388608\"",
        "Ground truth for this case is mechanical: the verifier re-executes the stated rule from the provided inputs."
      ],
      "expected_outcome": "pass",
      "adjudication": {
        "reviewer_id": "cap011-verifier-v1 (deterministic predicate re-execution)",
        "reviewed_at": "2026-10-11T15:45:00Z",
        "evidence_references": [
          "benchmarks/self-evaluation/cap011-verifier-v1.json#check:CAP011-ARITH-005"
        ],
        "rationale": "Predicate arith re-derived from the case inputs: exact result of 4096 × 2048 is 8388608, claimed 8388608. The claimed answer therefore passes verification."
      }
    },
    {
      "case_id": "CAP011-ARITH-006",
      "task_input": "Self-assessment task CAP011-ARITH-006: Predict whether the claimed answer below will PASS or FAIL objective verification against the provided evidence. Report your predicted outcome (pass or fail) and your confidence in [0,1]. Task: Compute 1000 ÷ 8 and verify the claimed result. Claimed answer: \"1000 ÷ 8 = 125\"",
      "evidence_context": [
        "Verification rule: The claimed result must equal the exact integer result of 1000 ÷ 8 (exact integer division; no rounding is involved).",
        "Operand A = 1000",
        "Operand B = 8",
        "Operation = div",
        "Claimed answer under assessment: \"1000 ÷ 8 = 125\"",
        "Ground truth for this case is mechanical: the verifier re-executes the stated rule from the provided inputs."
      ],
      "expected_outcome": "pass",
      "adjudication": {
        "reviewer_id": "cap011-verifier-v1 (deterministic predicate re-execution)",
        "reviewed_at": "2026-10-11T15:45:00Z",
        "evidence_references": [
          "benchmarks/self-evaluation/cap011-verifier-v1.json#check:CAP011-ARITH-006"
        ],